{
  "schema_version": "1.0.0",
  "taxonomy_version": "1.0.0",
  "id": "kentucky-route-zero",
  "title": "Kentucky Route Zero",
  "edition_pinned": "Steam app 231200, observed 2026-07-13.",
  "design_shape": {
    "register": {
      "primary": "narrative-first",
      "secondary": []
    },
    "loop_class": {
      "primary": "discovery",
      "secondary": [
        "expression"
      ]
    },
    "session_structure": {
      "primary": "chapters",
      "secondary": []
    },
    "progression_form": {
      "primary": "authored-campaign",
      "secondary": []
    },
    "player_count": {
      "primary": "solo",
      "secondary": []
    }
  },
  "market_genres": {
    "primary": "adventure",
    "secondary": []
  },
  "moat": "Dialogue-as-character-choice and magical-realist staging advance story without skill checks or fail states.",
  "scope_efficiency_hypothesis": "Act structure and scenic stages carry a long-form play using minimal interaction verbs.",
  "exemplar_rationale": "Exemplifies narrative-first adventure when choice shapes voice more than systemic outcomes.",
  "evidence": [
    {
      "claim": "Steam reported 4423 all-language, all-purchase user reviews.",
      "metric_type": "steam_user_reviews",
      "value_or_range": 4423,
      "class": "review-niche",
      "class_definition": "taxonomy-v1#steam-user-reviews/review-niche",
      "platform": "Steam",
      "territory": "worldwide",
      "observed_at": "2026-07-13",
      "source": "https://store.steampowered.com/appreviews/231200?json=1&language=all&purchase_type=all&num_per_page=0",
      "source_tier": "primary-platform"
    },
    {
      "claim": "Steam listed these storefront genres or main tags: Adventure; Indie.",
      "metric_type": "storefront_genres",
      "value_or_range": [
        "Adventure",
        "Indie"
      ],
      "class": "storefront-listed",
      "class_definition": "taxonomy-v1#storefront-genres/storefront-listed",
      "platform": "Steam",
      "territory": "United States",
      "observed_at": "2026-07-13",
      "source": "https://store.steampowered.com/api/appdetails?appids=231200&cc=us&l=en",
      "source_tier": "primary-platform"
    }
  ]
}
