{
  "schema_version": "1.0.0",
  "taxonomy_version": "1.0.0",
  "id": "xcom-2",
  "title": "XCOM 2",
  "edition_pinned": "Steam app 268500, observed 2026-07-13.",
  "design_shape": {
    "register": {
      "primary": "mechanics-first",
      "secondary": []
    },
    "loop_class": {
      "primary": "optimization",
      "secondary": [
        "discovery"
      ]
    },
    "session_structure": {
      "primary": "chapters",
      "secondary": []
    },
    "progression_form": {
      "primary": "authored-campaign",
      "secondary": [
        "persistent-unlocks"
      ]
    },
    "player_count": {
      "primary": "solo",
      "secondary": []
    }
  },
  "market_genres": {
    "primary": "strategy",
    "secondary": []
  },
  "moat": "Soldier permadeath binds cover and action-economy choices to the campaign roster and strategic layer.",
  "scope_efficiency_hypothesis": "Generated mission combinations reuse soldier classes, research, and tactical rules across one resistance campaign.",
  "exemplar_rationale": "Makes tactical risk matter beyond a mission by carrying soldiers, wounds, gear, and research forward.",
  "evidence": [
    {
      "claim": "Steam reported 108505 all-language, all-purchase user reviews.",
      "metric_type": "steam_user_reviews",
      "value_or_range": 108505,
      "class": "review-breakout",
      "class_definition": "taxonomy-v1#steam-user-reviews/review-breakout",
      "platform": "Steam",
      "territory": "worldwide",
      "observed_at": "2026-07-13",
      "source": "https://store.steampowered.com/appreviews/268500?json=1&language=all&purchase_type=all&num_per_page=0",
      "source_tier": "primary-platform"
    },
    {
      "claim": "Steam appdetails genres field listed: Strategy.",
      "metric_type": "storefront_genres",
      "value_or_range": [
        "Strategy"
      ],
      "class": "storefront-listed",
      "class_definition": "taxonomy-v1#storefront-genres/storefront-listed",
      "platform": "Steam",
      "territory": "United States",
      "observed_at": "2026-07-13",
      "source": "https://store.steampowered.com/api/appdetails?appids=268500&cc=us&l=en",
      "source_tier": "primary-platform"
    }
  ]
}
