{
  "schema_version": "1.0.0",
  "taxonomy_version": "1.0.0",
  "id": "balatro",
  "title": "Balatro",
  "edition_pinned": "Steam app 2379780, observed 2026-07-13.",
  "design_shape": {
    "register": {
      "primary": "mechanics-first",
      "secondary": []
    },
    "loop_class": {
      "primary": "optimization",
      "secondary": []
    },
    "session_structure": {
      "primary": "runs",
      "secondary": []
    },
    "progression_form": {
      "primary": "run-reset",
      "secondary": []
    },
    "player_count": {
      "primary": "solo",
      "secondary": []
    }
  },
  "market_genres": {
    "primary": "strategy",
    "secondary": [
      "casual"
    ]
  },
  "moat": "Jokers rewrite familiar poker scoring, so a small card vocabulary produces escalating combinatorial builds.",
  "scope_efficiency_hypothesis": "Known playing cards carry readability while jokers supply most of the combinatorial content.",
  "exemplar_rationale": "Shows how modifiers can multiply a universally understood base grammar.",
  "evidence": [
    {
      "claim": "Steam reported 194803 all-language, all-purchase user reviews.",
      "metric_type": "steam_user_reviews",
      "value_or_range": 194803,
      "class": "review-breakout",
      "class_definition": "taxonomy-v1#steam-user-reviews/review-breakout",
      "platform": "Steam",
      "territory": "worldwide",
      "observed_at": "2026-07-13",
      "source": "https://store.steampowered.com/appreviews/2379780?json=1&language=all&purchase_type=all&num_per_page=0",
      "source_tier": "primary-platform"
    },
    {
      "claim": "Steam listed these storefront genres or main tags: Casual; Indie; Strategy.",
      "metric_type": "storefront_genres",
      "value_or_range": [
        "Casual",
        "Indie",
        "Strategy"
      ],
      "class": "storefront-listed",
      "class_definition": "taxonomy-v1#storefront-genres/storefront-listed",
      "platform": "Steam",
      "territory": "United States",
      "observed_at": "2026-07-13",
      "source": "https://store.steampowered.com/api/appdetails?appids=2379780&cc=us&l=en",
      "source_tier": "primary-platform"
    }
  ]
}
