{
  "schema_version": "1.0.0",
  "taxonomy_version": "1.0.0",
  "id": "portal-2",
  "title": "Portal 2",
  "edition_pinned": "Steam app 620, observed 2026-07-13.",
  "design_shape": {
    "register": {
      "primary": "mechanics-first",
      "secondary": []
    },
    "loop_class": {
      "primary": "execution",
      "secondary": [
        "discovery",
        "social-coordination"
      ]
    },
    "session_structure": {
      "primary": "chapters",
      "secondary": [
        "rounds"
      ]
    },
    "progression_form": {
      "primary": "authored-campaign",
      "secondary": [
        "fixed-kit"
      ]
    },
    "player_count": {
      "primary": "solo",
      "secondary": [
        "cooperative"
      ]
    }
  },
  "market_genres": {
    "primary": "adventure",
    "secondary": [
      "action"
    ]
  },
  "moat": "Portals preserve traversal and momentum across surfaces, recombining one physics rule into distinct chambers.",
  "scope_efficiency_hypothesis": "A stable portal verb supports authored puzzles, traversal spectacle, and a separate co-op campaign.",
  "exemplar_rationale": "Demonstrates how one spatial rule can carry both solo discovery and coordinated execution.",
  "evidence": [
    {
      "claim": "Steam reported 463278 all-language, all-purchase user reviews.",
      "metric_type": "steam_user_reviews",
      "value_or_range": 463278,
      "class": "review-breakout",
      "class_definition": "taxonomy-v1#steam-user-reviews/review-breakout",
      "platform": "Steam",
      "territory": "worldwide",
      "observed_at": "2026-07-13",
      "source": "https://store.steampowered.com/appreviews/620?json=1&language=all&purchase_type=all&num_per_page=0",
      "source_tier": "primary-platform"
    },
    {
      "claim": "Steam listed these storefront genres or main tags: Action; Adventure.",
      "metric_type": "storefront_genres",
      "value_or_range": [
        "Action",
        "Adventure"
      ],
      "class": "storefront-listed",
      "class_definition": "taxonomy-v1#storefront-genres/storefront-listed",
      "platform": "Steam",
      "territory": "United States",
      "observed_at": "2026-07-13",
      "source": "https://store.steampowered.com/api/appdetails?appids=620&cc=us&l=en",
      "source_tier": "primary-platform"
    }
  ]
}
