{
  "schema_version": "1.0.0",
  "taxonomy_version": "1.0.0",
  "id": "outer-wilds",
  "title": "Outer Wilds",
  "edition_pinned": "Steam app 753640, observed 2026-07-13.",
  "design_shape": {
    "register": {
      "primary": "world-first",
      "secondary": [
        "narrative-first"
      ]
    },
    "loop_class": {
      "primary": "discovery",
      "secondary": []
    },
    "session_structure": {
      "primary": "chapters",
      "secondary": []
    },
    "progression_form": {
      "primary": "authored-campaign",
      "secondary": [
        "fixed-kit"
      ]
    },
    "player_count": {
      "primary": "solo",
      "secondary": []
    }
  },
  "market_genres": {
    "primary": "adventure",
    "secondary": [
      "action"
    ]
  },
  "moat": "A resetting solar system preserves player knowledge, revealing new routes without stat or inventory progression.",
  "scope_efficiency_hypothesis": "One clockwork world changes by time, letting locations serve several discoveries and story beats.",
  "exemplar_rationale": "Proves knowledge itself can be progression when world state is precise and reusable.",
  "evidence": [
    {
      "claim": "Steam reported 104907 all-language, all-purchase user reviews.",
      "metric_type": "steam_user_reviews",
      "value_or_range": 104907,
      "class": "review-breakout",
      "class_definition": "taxonomy-v1#steam-user-reviews/review-breakout",
      "platform": "Steam",
      "territory": "worldwide",
      "observed_at": "2026-07-13",
      "source": "https://store.steampowered.com/appreviews/753640?json=1&language=all&purchase_type=all&num_per_page=0",
      "source_tier": "primary-platform"
    },
    {
      "claim": "Steam listed these storefront genres or main tags: Action; Adventure.",
      "metric_type": "storefront_genres",
      "value_or_range": [
        "Action",
        "Adventure"
      ],
      "class": "storefront-listed",
      "class_definition": "taxonomy-v1#storefront-genres/storefront-listed",
      "platform": "Steam",
      "territory": "United States",
      "observed_at": "2026-07-13",
      "source": "https://store.steampowered.com/api/appdetails?appids=753640&cc=us&l=en",
      "source_tier": "primary-platform"
    }
  ]
}
