{
  "schema_version": "1.0.0",
  "taxonomy_version": "1.0.0",
  "id": "counter-strike-2",
  "title": "Counter-Strike 2",
  "edition_pinned": "Steam app 730, observed 2026-07-13.",
  "design_shape": {
    "register": {
      "primary": "mechanics-first",
      "secondary": []
    },
    "loop_class": {
      "primary": "execution",
      "secondary": [
        "social-coordination"
      ]
    },
    "session_structure": {
      "primary": "rounds",
      "secondary": []
    },
    "progression_form": {
      "primary": "fixed-kit",
      "secondary": []
    },
    "player_count": {
      "primary": "competitive",
      "secondary": []
    }
  },
  "market_genres": {
    "primary": "action",
    "secondary": []
  },
  "moat": "Dynamic smoke reacts to gunfire and blasts, letting teams briefly cut or expand contested sightlines.",
  "scope_efficiency_hypothesis": "Resetting objective rounds reuse a tight map pool while economy, utility, and opponent plans alter each attack.",
  "exemplar_rationale": "Shows fixed-kit competition deepened by readable maps, team utility, and repeatable execution.",
  "evidence": [
    {
      "claim": "Steam reported 9720017 all-language, all-purchase user reviews.",
      "metric_type": "steam_user_reviews",
      "value_or_range": 9720017,
      "class": "review-breakout",
      "class_definition": "taxonomy-v1#steam-user-reviews/review-breakout",
      "platform": "Steam",
      "territory": "worldwide",
      "observed_at": "2026-07-13",
      "source": "https://store.steampowered.com/appreviews/730?json=1&language=all&purchase_type=all&num_per_page=0",
      "source_tier": "primary-platform"
    },
    {
      "claim": "Steam appdetails genres field listed: Action; Free To Play.",
      "metric_type": "storefront_genres",
      "value_or_range": [
        "Action",
        "Free To Play"
      ],
      "class": "storefront-listed",
      "class_definition": "taxonomy-v1#storefront-genres/storefront-listed",
      "platform": "Steam",
      "territory": "United States",
      "observed_at": "2026-07-13",
      "source": "https://store.steampowered.com/api/appdetails?appids=730&cc=us&l=en",
      "source_tier": "primary-platform"
    }
  ]
}
