{
  "schema_version": "1.0.0",
  "taxonomy_version": "1.0.0",
  "id": "cuphead",
  "title": "Cuphead",
  "edition_pinned": "Steam app 268910, observed 2026-07-13.",
  "design_shape": {
    "register": {
      "primary": "mechanics-first",
      "secondary": []
    },
    "loop_class": {
      "primary": "execution",
      "secondary": []
    },
    "session_structure": {
      "primary": "rounds",
      "secondary": [
        "chapters"
      ]
    },
    "progression_form": {
      "primary": "authored-campaign",
      "secondary": [
        "persistent-unlocks"
      ]
    },
    "player_count": {
      "primary": "solo",
      "secondary": [
        "cooperative"
      ]
    }
  },
  "market_genres": {
    "primary": "action",
    "secondary": []
  },
  "moat": "Readable boss telegraphs and rapid restarts turn repeated deaths into learned execution sequences.",
  "scope_efficiency_hypothesis": "Boss phases reuse a compact move set while changing timing, positioning, and attack-reading demands.",
  "exemplar_rationale": "Demonstrates how encounter iteration and clear feedback can sustain a narrow execution loop.",
  "evidence": [
    {
      "claim": "Steam reported 216360 all-language, all-purchase user reviews.",
      "metric_type": "steam_user_reviews",
      "value_or_range": 216360,
      "class": "review-breakout",
      "class_definition": "taxonomy-v1#steam-user-reviews/review-breakout",
      "platform": "Steam",
      "territory": "worldwide",
      "observed_at": "2026-07-13",
      "source": "https://store.steampowered.com/appreviews/268910?json=1&language=all&purchase_type=all&num_per_page=0",
      "source_tier": "primary-platform"
    },
    {
      "claim": "Steam's appdetails genres field listed: Action; Indie.",
      "metric_type": "storefront_genres",
      "value_or_range": [
        "Action",
        "Indie"
      ],
      "class": "storefront-listed",
      "class_definition": "taxonomy-v1#storefront-genres/storefront-listed",
      "platform": "Steam",
      "territory": "United States",
      "observed_at": "2026-07-13",
      "source": "https://store.steampowered.com/api/appdetails?appids=268910&cc=us&l=en",
      "source_tier": "primary-platform"
    }
  ]
}
