{
  "schema_version": "1.0.0",
  "taxonomy_version": "1.0.0",
  "id": "trackmania",
  "title": "Trackmania",
  "edition_pinned": "Steam app 2225070, observed 2026-07-13.",
  "design_shape": {
    "register": {
      "primary": "mechanics-first",
      "secondary": []
    },
    "loop_class": {
      "primary": "execution",
      "secondary": []
    },
    "session_structure": {
      "primary": "rounds",
      "secondary": []
    },
    "progression_form": {
      "primary": "fixed-kit",
      "secondary": []
    },
    "player_count": {
      "primary": "competitive",
      "secondary": [
        "solo"
      ]
    }
  },
  "market_genres": {
    "primary": "racing",
    "secondary": []
  },
  "moat": "Ghost-mediated time attack and shared track geometry turn a fixed car kit into rivalled precision racing.",
  "scope_efficiency_hypothesis": "One physics model and track editor supply solo ghosts, hot seats, and multiplayer cups.",
  "exemplar_rationale": "Isolates competitive execution depth from car customization and career progression systems.",
  "evidence": [
    {
      "claim": "Steam reported 21010 all-language, all-purchase user reviews.",
      "metric_type": "steam_user_reviews",
      "value_or_range": 21010,
      "class": "review-established",
      "class_definition": "taxonomy-v1#steam-user-reviews/review-established",
      "platform": "Steam",
      "territory": "worldwide",
      "observed_at": "2026-07-13",
      "source": "https://store.steampowered.com/appreviews/2225070?json=1&language=all&purchase_type=all&num_per_page=0",
      "source_tier": "primary-platform"
    },
    {
      "claim": "Steam listed these storefront genres or main tags: Racing.",
      "metric_type": "storefront_genres",
      "value_or_range": [
        "Racing"
      ],
      "class": "storefront-listed",
      "class_definition": "taxonomy-v1#storefront-genres/storefront-listed",
      "platform": "Steam",
      "territory": "United States",
      "observed_at": "2026-07-13",
      "source": "https://store.steampowered.com/api/appdetails?appids=2225070&cc=us&l=en",
      "source_tier": "primary-platform"
    }
  ]
}
